{
  "active_profile_ids": [
    "C01"
  ],
  "contextual_rules": [
    {
      "id": "C01:R01",
      "instruction": "Collegare concetto astratto, relazione fisica e bilanciamento dimensionale necessario. Il formalismo ha una funzione esplicativa, non è fine a sé stesso; il modello scelto non equivale alla spiegazione completa della natura fisica. Passare da condizioni costanti a variabili solo se serve all'obiettivo.",
      "selection": {
        "profile_ids": [
          "C01"
        ],
        "reason": "Condizione esplicita del brief soddisfatta.",
        "source_pattern_ids": [
          "DPC:T0003",
          "DPC:T0008",
          "EPC:T0009",
          "EPC:T0014"
        ]
      },
      "when": "Si impiegano concetti matematici per grandezze o fenomeni fisici."
    }
  ],
  "devices": [
    {
      "id": "D01",
      "instruction": "Formulare una domanda che il passo successivo affronta concretamente. È una risorsa frequente del registro, non un motivo per interrogare ogni paragrafo.",
      "selection": {
        "profile_ids": [
          "C01"
        ],
        "reason": "Risorsa contestuale; priorità risolta in status_basis.",
        "source_pattern_ids": [
          "APC:R0003"
        ]
      },
      "status": "available",
      "status_basis": "context_available",
      "when": "Uno snodo richiede di chiarire un'applicazione, una spiegazione, una diagnosi o un nuovo compito. Nel compito corrente: domanda che introduce un passo affrontato realmente dal seguito."
    },
    {
      "id": "D02",
      "instruction": "Scegliere il dispositivo adatto: scenario con condizioni pertinenti oppure calcolo con valori e unità espliciti. I due usi non sono equivalenti; lo scenario è privilegiato nella divulgazione e meno nei tutorial. I numeri illustrativi non sono dati misurati né validazione generale del modello.",
      "selection": {
        "profile_ids": [
          "C01"
        ],
        "reason": "Risorsa contestuale; priorità risolta in status_basis.",
        "source_pattern_ids": [
          "APC:R0010",
          "APC:R0012"
        ]
      },
      "status": "required",
      "status_basis": "task_requirement",
      "when": "Un sistema ipotetico aiuta a impostare il ragionamento oppure valori determinati chiariscono un'operazione. Nel compito corrente: passaggio di calcolo numerico."
    }
  ],
  "guardrails": [
    {
      "id": "G01",
      "instruction": "Non attivare tutti i principi o dispositivi in ogni testo e non imporre una scaletta, una posizione fissa o quote di figure retoriche. Le condizioni del profilo e gli ambiti autorizzati dei singoli ID restano vincolanti anche quando più pattern sono composti nello stesso principio.",
      "selection": {
        "profile_ids": [
          "C01"
        ],
        "reason": "Vincolo collegato: obbligatorio, non disattivabile.",
        "source_pattern_ids": [
          "APC:R0003",
          "APC:R0004",
          "APC:R0005",
          "APC:R0010",
          "APC:R0012",
          "APC:R0013"
        ]
      }
    },
    {
      "id": "G02",
      "instruction": "Non inventare esperienze personali né un disagio condiviso da tutti. Non dare per acquisiti ricordi e formazione; ripresentare l'informazione necessaria. Non usare mai un'omissione per suggerire che il lettore non capirebbe e non rassicurare banalizzando una difficoltà reale.",
      "selection": {
        "profile_ids": [
          "C01"
        ],
        "reason": "Vincolo collegato: obbligatorio, non disattivabile.",
        "source_pattern_ids": [
          "APC:R0001",
          "APC:R0011",
          "APC:R0013",
          "DPC:E0001"
        ]
      }
    },
    {
      "id": "G03",
      "instruction": "Le interpretazioni non verificate restano ipotesi, senza attenuare risultati accertati o inventare cause alternative. Qualificare temporalmente le informazioni mutevoli; distinguere preferenze e requisiti senza presumere equivalenza fra tutte le opzioni. Le perdite informative mantengono natura e portata proprie, senza equiparare fenomeni diversi.",
      "selection": {
        "profile_ids": [
          "C01"
        ],
        "reason": "Vincolo collegato: obbligatorio, non disattivabile.",
        "source_pattern_ids": [
          "EPC:E0001",
          "EPC:T0001",
          "EPC:T0003",
          "EPC:T0011"
        ]
      }
    },
    {
      "id": "G04",
      "instruction": "Non trasformare somiglianza in identità o generalizzazione dimostrata, analogia in prova del modello, storia in progresso lineare inevitabile o caso numerico in validazione generale. Non gonfiare applicazioni celebri o estendere il contrasto quantistico a una confutazione generale della fisica classica.",
      "selection": {
        "profile_ids": [
          "C01"
        ],
        "reason": "Vincolo collegato: obbligatorio, non disattivabile.",
        "source_pattern_ids": [
          "APC:R0002",
          "APC:R0004",
          "APC:R0005",
          "APC:R0006",
          "APC:R0008",
          "APC:R0012"
        ]
      }
    },
    {
      "id": "G05",
      "instruction": "Nelle omissioni dichiarate evitare di norma tautologie e spiegazioni lapalissiane dell'esclusione. Nel modello luminoso non elencare limiti totalmente tautologici o lapalissiani. Non eliminare passaggi indispensabili per il solo desiderio di delimitare il testo; non convertire queste cautele nell'obbligo di esplicitare ogni limite possibile.",
      "selection": {
        "profile_ids": [
          "C01"
        ],
        "reason": "Vincolo collegato: obbligatorio, non disattivabile.",
        "source_pattern_ids": [
          "DPC:E0001",
          "EPC:T0010"
        ]
      }
    },
    {
      "id": "G06",
      "instruction": "Anticipazioni e distribuzione in articoli successivi hanno rischio alto: usarle solo con un piano reale. Dichiarare di norma prima la serie; non inventare contenuto, destinazione o scadenza del seguito e non rinviare ciò che serve oggi. Un annuncio osservato nel corpus non dimostra che il seguito sia stato realizzato.",
      "selection": {
        "profile_ids": [
          "C01"
        ],
        "reason": "Vincolo collegato: obbligatorio, non disattivabile.",
        "source_pattern_ids": [
          "APC:R0007",
          "DPC:E0002"
        ]
      }
    },
    {
      "id": "G09",
      "instruction": "Non aggiungere matematica, generalizzazioni a condizioni variabili, scenari o calcoli soltanto per imitare il registro. Il bilanciamento dimensionale è necessario quando si raccordano concetti matematici e grandezze fisiche, non un ornamento facoltativo; la sua esplicitazione autoriale è circoscritta alla divulgazione scientifica. Non presentare il modello astratto come descrizione fisica completa o come rifiuto di esempi e analogie.",
      "selection": {
        "profile_ids": [
          "C01"
        ],
        "reason": "Vincolo collegato: obbligatorio, non disattivabile.",
        "source_pattern_ids": [
          "APC:R0010",
          "APC:R0012",
          "DPC:T0003",
          "DPC:T0008",
          "EPC:T0009",
          "EPC:T0014"
        ]
      }
    },
    {
      "id": "G10",
      "instruction": "I principi coordinati non allargano le applicabilità ristrette: ritratto di fase, dati del modello luminoso, analogie nelle reti sociali e confronto classico/quantistico nella logica o misura restano subordinati a queste condizioni: Si presenta il ritratto di fase come strumento di comprensione; Si descrivono il modello di illuminazione e i suoi dati di ingresso; Si spiegano unità combinatorie o aggregazione gerarchica nelle reti sociali; Si confrontano proprietà o attese classiche e comportamento quantistico nella logica o nella misura. Il supporto monoarticolo resta visibile come tale e non dimostra ricorrenza indipendente; una dichiarazione autoriale più ampia non modifica i conteggi del corpus.",
      "selection": {
        "profile_ids": [
          "C01"
        ],
        "reason": "Vincolo collegato: obbligatorio, non disattivabile.",
        "source_pattern_ids": [
          "APC:R0006",
          "APC:R0008",
          "EPC:T0008",
          "EPC:T0010"
        ]
      }
    }
  ],
  "principles": [
    {
      "id": "P04",
      "instruction": "Scegliere un modello e un livello di formalismo che servano alla comprensione, sostenendoli con scenari o calcoli quando utili. Solo nella divulgazione scientifica raccordare astrazione matematica, relazione fisica e necessario bilanciamento dimensionale; estendere il caso costante a quello variabile quando pertinente. Non imporre ai tutorial le scelte formali specifiche della divulgazione scientifica.",
      "selection": {
        "profile_ids": [
          "C01"
        ],
        "reason": "Tipo di testo e segnali espliciti del brief.",
        "source_pattern_ids": [
          "APC:R0010",
          "APC:R0012",
          "DPC:T0003",
          "DPC:T0008",
          "EPC:T0009",
          "EPC:T0014"
        ]
      }
    },
    {
      "id": "P06",
      "instruction": "Usare domande-cerniera, complicità colloquiale e richiami a conoscenze familiari come risorse disponibili, non tic obbligatori. Delimitare il perimetro quando informativo; distribuire contenuti e annunciare seguiti soltanto se pianificati. La spiegazione resta accessibile senza attribuire incapacità al lettore o promettere una serie che non è stata definita.",
      "selection": {
        "profile_ids": [
          "C01"
        ],
        "reason": "Tipo di testo e segnali espliciti del brief.",
        "source_pattern_ids": [
          "APC:R0001",
          "APC:R0003",
          "APC:R0007",
          "APC:R0011",
          "DPC:E0001",
          "DPC:E0002"
        ]
      }
    }
  ],
  "provenance": {
    "identifier_schema_sha256": "0e984549f77ca12027b4e407886a38e768f018c32a5f4f443191454a75e97e36",
    "runtime_compiler_sha256": "328e1dfeea047095b6ffd737303b42dde772583a0d9d56f5ef850516e1887afb",